{
  "queryID": "some-uuid",
  "topicID": "some-uuid",
  "userID": "some-uuid",
  "startTime": 1091201,
  "i2b2QueryText": "some-xml",
  "extraXmlBaggage": "some-xml",
  "queryResults": [
    {
      "status": "Success",
      "resultID": "some-uuid",
      "adapterID": "some-uuid",
      "count": 129084,
      "noiseTerms": {
        "clamp": 3,
        "sigma": 3,
        "rounding": 3
      },
      "breakdowns": [
        {
          "category": "Gender",
          "results": [
            {
              "name": "Male",
              "count": 333
            },
            {
              "name": "Female",
              "count": 333
            }
          ]
        }
      ],
      "i2b2Mapping": "<xml>stuff</xml>"
    }
  ]
}